source_id,source_name,source_type,authority,location,n_files,content,ingestion_script,version,status,last_updated,notes
pumf_rdata,CCHS PUMF RData files,data,primary,cchsflow-data/data/sources/rdata/,11,"Ground truth: variable names, R types, factor levels with frequencies",ingestion/ingest_pumf_rdata.R,1,active,2026-02-16,Tier 1. One file per cycle (2001-2022). StatCan PUMF microdata converted to R format.
ddi_xml,CCHS DDI XML documentation,documentation,primary,cchsflow-data/ddi/,11,"Labels, question text, universe, response categories, position/length",ingestion/ingest_ddi_xml.R,1,active,2026-02-16,Tier 1. One file per PUMF cycle. Data Documentation Initiative standard.
cchsflow,cchsflow R package worksheets,derived,secondary,cchsflow/inst/extdata/,2,"Harmonised variable names, family mappings, section/subject classification",ingestion/ingest_cchsflow_families.R,1,active,2026-02-16,variables.csv and variable_details.csv from Big-Life-Lab/cchsflow
ices_scrape,ICES Data Dictionary scrape,scrape,secondary,data/ices_cchs_dictionary.duckdb,1,"Variable names, abbreviated labels, dataset IDs, value formats",ingestion/ingest_ices_scrape.R,1,active,2026-02-16,Scraped from ICES Data Dictionary website. 14005 variables across 239 datasets. Labels are abbreviated.
yaml_extract,Extracted YAML data dictionaries,extraction,secondary,cchs-extracted/data-dictionary/,42,"Variable definitions from PDF data dictionaries (21 Master, 18 PUMF, 3 Share)",ingestion/ingest_yaml_extract.R,1,draft,2026-02-16,Tier 2. AI-extracted from StatCan PDF user guides. Quality varies. Not yet integrated.
