"variable_name","length","position","label","question_text","universe","note","n_categories"
"VERDATE","8.0","1","Date of file creation","","All respondents","Format = YYYYMMDD","0"
"REFPER","13.0","9","Reference period","","All respondents","Reference period during which data included in this file have been collected.","0"
"SAMPLEID","24.0","22","Record identifier","","All respondents","Unique number to identify dwelling (area frame).","0"
"INSTANCE","2.0","46","Person identifier of selected respondent - health interview","","All respondents","","0"
"COLMODE","1.0","48","Collection mode - 18+","","All respondents","","3"
"COL_LANG","1.0","49","Collection language","","All respondents","","2"
"GEO_PRV","2.0","50","Province of residence of respondent","","All respondents","","10"
"GEODVPC","6.0","52","Postal code - (D)","","See documentation on derived variables.","Due to the high number of categories, frequencies are not shown for this variable. Due to missing or incorrect reporting, the postal code variable is imputed from a donor. See derived variables documentation for more information. Note that while the postal code variable is available on the data files for analysis, no aggregate data should be disseminated at this level of geography.","0"
"GEODVD21","8.0","58","2021 Census dissemination area (DA)","","See documentation on derived variables.","Due to the high number of categories, frequencies are not shown for this variable.","0"
"GEODVD16","8.0","66","2016 Census dissemination area (DA) - (D)","","See documentation on derived variables.","Due to the high number of categories, frequencies are not shown for this variable.","0"
"GEODVCSD","7.0","74","2021 Census subdivision (CSD) - (D)","","See documentation on derived variables.","Due to the high number of categories, frequencies are not shown for this variable.","0"
"GEODVFED","5.0","81","2021 Census federal electoral district (FED) - (D)","","See documentation on derived variables.","Due to the high number of categories, frequencies are not shown for this variable.","0"
"GEODVCD","4.0","86","2021 Census division (CD) - (D)","","See documentation on derived variables.","Due to the high number of categories, frequencies are not shown for this variable.","0"
"GEODVCMA","3.0","90","2021 Census metropolitan area (CMA) - (D)","","See documentation on derived variables.","","42"
"GEODVCA","3.0","93","2021 Census agglomeration (CA) - (D)","","See documentation on derived variables.","","0"
"GEODVSAT","3.0","96","Statistical area classification type (SAT) - (D)","","See documentation on derived variables.","","7"
"GEODVHR4","4.0","99","Health region 2023 - (D)","","See documentation on derived variables.","","100"
"GEODVP21","1.0","103","Peer group 2021 - (D)","","See documentation on derived variables.","","9"
"GEODVUR","2.0","104","Population centre or rural area type - (D)","","See documentation on derived variables.","","6"
"GEODVUR2","1.0","106","Population centre or rural area type - grouped - (D)","","See documentation on derived variables.","","2"
"GEODVPSZ","1.0","107","Population centre or rural area classification - (D)","","See documentation on derived variables.","","4"
"GEODVBHA","4.0","108","British Columbia Health Authority (BCHA) - (D)","","See documentation on derived variables.","Due to the high number of categories, frequencies are not shown for this variable.","0"
"GEODVOHR","4.0","112","Ontario Health Region (OHR)","","See documentation on derived variables.","Replaces Home and Community Care Support Services (HCCSS)","7"
"GEODVASZ","6.0","116","Alberta subzone - (D)","","See documentation on derived variables.","Due to the high number of categories, frequencies are not shown for this variable.","0"
"SAM_CP","6.0","122","Sampled collection period","","All respondents","The collection periods are usually comprised of three months of collection. The values represent the year and the beginning month of each period based on the 2023 collection. However, to accommodate collection demands of other Statistics Canada surveys in the field at the time, CCHS interviewers were allocated to other projects and the second collection period was extended to July and overlaps the third period.","4"
"ADM_YOI","4.0","128","Year of interview","","All respondents","","1"
"ADM_MOI","2.0","132","Month of interview","","All respondents","","12"
"ADM_DOI","2.0","134","Day of interview","","All respondents","","1"
"SAMDVLNK","1.0","136","Permission to link data - (D)","","All respondents","See documentation on derived variables.","2"
"SAMDVSHR","1.0","137","Permission to share data - (D)","","All respondents","See documentation on derived variables.","2"
"DHHDVHSZ","2.0","138","Household size - (D)","","See documentation on derived variables.","","1"
"DHHDVLVG","2.0","140","Living / family arrangement of selected respondent - (D)","","See documentation on derived variables.","","11"
"DHHDV611","2.0","142","Number of persons in household between 6 and 11 years of age - (D)","","See documentation on derived variables.","","1"
"DHHDVOKD","2.0","144","Number of persons in household 16 or 17 years of age - (D)","","See documentation on derived variables.","","1"
"DHHDVL12","2.0","146","Number of persons in household less than 12 years of age - (D)","","See documentation on derived variables.","","1"
"DHHDVYKD","2.0","148","Number of persons in household less than 16 years of age - (D)","","See documentation on derived variables.","","1"
"DHHDVLE5","2.0","150","Number of persons in household 5 years old or less - (D)","","See documentation on derived variables.","","1"
"DHHDVA65","2.0","152","Number of persons in household aged 65 and older - (D)","","See documentation on derived variables.","","2"
"DHHDVAOS","3.0","154","Age of spouse - (D)","","See documentation on derived variables.","","2"
"DHHDVL18","2.0","157","Number of persons in household less than 18 years of age - (D)","","See documentation on derived variables.","","1"
"PROXYSEX","1.0","159","Respondent gender and whether interview conducted by proxy","","All respondents","","4"
"DWL_01A","1.0","160","Dwelling ownership - own or rent","Is this dwelling owned by a member of this household?","All respondents","","3"
"ED_05","2.0","161","Highest certificate, diploma or degree completed","What is this person’s highest certificate, diploma or degree completed? [First name] [Last name], [Age]","All respondents","","8"
"EDDVR3","1.0","163","Highest level of education - respondent, 3 levels - (D)","","See documentation on derived variables.","","4"
"EDDVH3","1.0","164","Highest level of education - household, 3 levels - (D)","","See documentation on derived variables.","","4"
"AGE_01A","4.0","165","Year of birth","What is [your / respondent name] date of birth? Year","All respondents","","0"
"AGE_01B","2.0","169","Month of birth","What is [your / respondent name] date of birth? Month","All respondents","","0"
"AGE_01C","2.0","171","Day of birth","What is [your / respondent name] date of birth? Day","All respondents","","0"
"AWCAGE","3.0","173","Age","","All respondents","","1"
"DHH_SEX","1.0","176","Sex at birth","","All respondents","","2"
"GDRA_10","1.0","177","Gender","What is your gender?","All respondents","The ’Gender diverse’ category includes persons reporting a gender other than male or female, persons reporting being unsure of their gender, persons reporting being both male and female, or neither male nor female. For this question, write-in responses were coded into one of the existing listed categories if the write-in information duplicated a listed category.","4"
"GENDER_2","1.0","178","Gender - imputed","","All respondents","Men+ includes men (and/or boys), as well as some non-binary persons. Women+ includes women (and/or girls), as well as some non-binary persons.","2"
"DOMAC","1.0","179","Main activity - Inclusion Flag - (F)","","All respondents","","1"
"MA_01","1.0","180","Worked at job / business - 12 mo","In the past 12 months, did you work at a job or business?","Respondents aged 18 to 75 with DOMAC = 1","","4"
"MA_01A","1.0","181","Main activity - worked at job / business - 12 mo","In the past 12 months, was working at a job or business your main activity?","Respondents who answered MA_01 = 1","","4"
"MA_02","2.0","182","Main activity - 12 mo","During the past 12 months, what was your main activity?","Respondents aged 18 to 75 who answered MA_01 = (2, NR) or MA_01A = (2, NR)","For this question, write-in responses were coded into one of the existing listed categories if the write-in information duplicated a listed category.","11"
"DOEDC","1.0","184","School attendance - Inclusion Flag - (F)","","All respondents","","1"
"EDC_10","1.0","185","Currently attending school / college / CEGEP / university","Are you currently attending a school, college, CEGEP or university?","Respondents with DOEDC = 1","","3"
"EDC_20","1.0","186","Student status","Are you enrolled as a full-time or part-time student? Each educational institution classifies students as full-time or part-time depending on the type of program, and the number of courses, credits or hours of instruction.","Respondents who answered EDC_10 = 1","","4"
"DOGEN","1.0","187","General health - Inclusion Flag - (F)","","All respondents","","1"
"GEN_01","1.0","188","Perceived health","In general, how is your health?","Respondents with DOGEN = 1","","6"
"GEN_05","1.0","189","Perceived mental health","In general, how is your mental health?","Respondents with DOGEN = 1 and PROXYSEX = (1, 2)","","6"
"GEN_10","1.0","190","Perceived life stress","Thinking about the amount of stress in your life, how would you describe most of your days?","Respondents with DOGEN = 1","","6"
"GEN_15","1.0","191","Perceived stress at work","How would you describe most days at work?","Respondents with DOGEN = 1 and DV_WORK12 = 1 and PROXYSEX = (1, 2)","DV_WORK12 indicates if the respondent (aged 18 to 75) worked at a job or business in the past 12 months (MA_01 = 1 or MA_01A = 1).","7"
"GEN_20","1.0","192","Sense of belonging to local community","How would you describe your sense of belonging to your local community?","Respondents with DOGEN = 1","","5"
"DOLSM","1.0","193","Life satisfaction measures - Inclusion Flag - (F)","","All respondents","","1"
"LSM_01","2.0","194","Satisfaction with life in general","Using a scale of 0 to 10, where 0 means ""Very dissatisfied"" and 10 means ""Very satisfied"", how do you feel about your life as a whole right now?","Respondents with DOLSM = 1 and PROXYSEX = (1, 2)","","12"
"LSMDVSWL","1.0","196","Satisfaction with life in general (D)","","See documentation on derived variables.","","6"
"DOPRS","1.0","197","Pregnancy - Inclusion Flag - (F)","","All respondents","","1"
"PRS_05","1.0","198","Currently pregnant","Are you pregnant?","Respondents aged 18 to 55 with DHH_SEX = 2 and DOPRS = 1","","4"
"DOHWT","1.0","199","Height and weight - Inclusion Flag - (F)","","All respondents","","1"
"HWT_05A","2.0","200","Height (self-reported) - Feet","How tall are you without shoes on? Feet","Respondents with DOHWT = 1 and PRS_05 <> 1","","3"
"HWT_05B","2.0","202","Height (self-reported) - Inches","How tall are you without shoes on? Inches","Respondents with DOHWT = 1 and PRS_05 <> 1","","3"
"HWT_05C","3.0","204","Height (self-reported) - Centimetres","How tall are you without shoes on? Centimetres","Respondents with DOHWT = 1 and PRS_05 <> 1","","3"
"HWT_40A","3.0","207","Weight (self-reported)","How much do you weigh? Weight","Respondents with DOHWT = 1 and PRS_05 <> 1","","3"
"HWT_40B","1.0","210","Weight (self-reported) - unit of measure in pounds or kilograms","How much do you weigh? Pounds or kilograms","Respondents with DOHWT = 1 and PRS_05 <> 1","","4"
"HWTDVHTM","5.3","211","Height (metres) - self-reported - (D)","","See documentation on derived variables.","","2"
"HWTDVWTK","6.2","216","Weight (kilograms) - self-reported - (D)","","See documentation on derived variables.","","2"
"HWTDVBMI","6.2","222","Body mass index (self-reported) - (D)","","See documentation on derived variables.","","2"
"HWTDVISW","2.0","228","BMI classification age 18 + (self-reported) - Intl standard - (D)","","See documentation on derived variables.","","8"
"HWTDVCOR","6.2","230","Body mass index (adjusted) - (D)","","See documentation on derived variables.","","2"
"HWTDVBCC","2.0","236","BMI classification age 18 + (adjusted) - Intl standard - (D)","","See documentation on derived variables.","","8"
"DOCOVC","1.0","238","COVID-19 C - Inclusion Flag - (F)","","All respondents","","1"
"COVC_015","1.0","239","Has experienced COVID-19 symptoms - last 3 months","In the last 3 months, have you experienced any symptoms that led you to believe that you had COVID-19, such as fever, cough, headache, sore throat, runny nose, difficulty breathing, tiredness or loss of taste or smell?","Respondents with DOCOVC = 1 and PROXYSEX = (1, 2)","","3"
"COVC_020","1.0","240","Followed provincial guidelines while COVID-19 symptoms","While you were experiencing these symptoms, did you follow provincial guidelines (e.g., self-isolate for a required number of days)?","Respondents who answered COVC_015 = 1","","4"
"DOCOVD","1.0","241","COVID-19 D - Inclusion Flag - (F)","","All respondents","","1"
"COVD_038","1.0","242","Vaccinated against COVID-19","Have you been vaccinated against COVID-19?","Respondents with DOCOVD = 1 and PROXYSEX = (1, 2)","","3"
"COVD_030","1.0","243","COVID-19 vaccine - requires 1 or 2 doses","Does the vaccine you received require one or two doses?","Respondents who answered COVD_038 = 1","","4"
"COVD_035","1.0","244","COVID-19 vaccine - number of doses received so far","How many doses of the COVID-19 vaccine have you received so far?","Respondents who answered COVD_038 = 1","","7"
"COVD_36A","2.0","245","Last dose of COVID-19 vaccine - month","When did you receive your last dose of a COVID-19 vaccine? Month","Respondents who answered COVD_030 = (1, 2)","","14"
"COVD_36B","4.0","247","Last dose of COVID-19 vaccine - year","When did you receive your last dose of a COVID-19 vaccine? Year","Respondents who answered COVD_030 = (1, 2)","","6"
"DOCOVE","1.0","251","COVID-19 E - Inclusion Flag - (F)","","All respondents","","1"
"COVE_041","2.0","252","COVID-19 vaccine - main reason why not vaccinated","What is the main reason why you haven’t been vaccinated against COVID-19?","Respondents with DOCOVE = 1 and PROXYSEX = (1, 2) and who answered COVD_038 <> 1","","8"
"COVE_055","2.0","254","COVID-19 vaccine - main reason why not received booster dose","What is the main reason why you haven’t received a booster dose?","Respondents who answered ((COVD_030 = 1 and COVD_035 = 1) or (COVD_030 = 2 and COVD_035 = 2))","","9"
"DOCOVF","1.0","256","COVID-19 F - Inclusion Flag - (F)","","All respondents","","1"
"COVF_60A","1.0","257","COVID-19 vaccine - likeliness of getting booster dose","How likely is it that you would get a booster dose?","Respondents with DOCOVF = 1 and PROXYSEX = (1, 2) and who answered ((COVD_030 = 1 and COVD_035 = 1) or (COVD_030 = 2 and COVD_035 = 2))","","5"
"DOCCC","1.0","258","Chronic conditions - Inclusion Flag - (F)","","All respondents","","1"
"CCC_05","1.0","259","Has diabetes","Do you have diabetes?","Respondents with DOCCC = 1","","3"
"CCC_10","3.0","260","Diabetes - age first diagnosed","How old were you when this was first diagnosed?","Respondents who answered CCC_05 = 1","","3"
"CCC_15","1.0","263","Diabetes - diagnosed - during pregnancy","Were you pregnant when you were first diagnosed with diabetes?","Respondents who answered CCC_05 = 1 and DHH_SEX = 2 and AWCAGE > 18 and (CCC_10 = NONRESPONSE or (CCC_10 > 12 and CCC_10 < 60))","","4"
"CCC_20","1.0","264","Diabetes - diagnosed - other than during pregnancy","Other than during pregnancy, has a health professional ever told you that you have diabetes?","Respondents who answered CCC_15 = 1","","4"
"CCC_30","2.0","265","Diabetes - time between diagnosis and start of insulin","When you were first diagnosed with diabetes, how long was it before you were started on insulin?","Respondents who answered CCC_05 = 1 and CCC_20 <> 2","","8"
"CCC_35","1.0","267","Diabetes - currently takes insulin","Do you currently take insulin for your diabetes?","Respondents who answered CCC_05 = 1 and CCC_20 <> 2","","4"
"CCC_40","1.0","268","Diabetes - took pills to control blood sugar - 1 mo","In the past month, did you take pills to control your blood sugar?","Respondents who answered CCC_05 = 1 and CCC_20 <> 2","","4"
"CCC_45","1.0","269","Has been diagnosed with cancer - lifetime","Have you ever been diagnosed with cancer?","Respondents with DOCCC = 1","","3"
"CCC_50","3.0","270","Cancer - age first diagnosed","How old were you when this was first diagnosed?","Respondents who answered CCC_45 = 1","","3"
"CCC_55","1.0","273","Cancer - received treatment - 12 mo","Have you received treatment for cancer in the past 12 months?","Respondents who answered CCC_45 = (1, NONRESPONSE)","","4"
"CCC_60A","1.0","274","Type of cancer - breast","What type of cancer were you diagnosed with? - Breast","Respondents who answered CCC_45 = 1 or CCC_55 = 1","In the questionnaire, this variable is found under the question CCC_Q60 category # 1. For this question, write-in responses were coded into one of the existing listed categories if the write-in information duplicated a listed category.","4"
"CCC_65A","1.0","275","Type of cancer - prostate","What type of cancer were you diagnosed with? - Prostate","Respondents with DHH_SEX = 1 and CCC_45 = 1 or CCC_55 = 1","In the questionnaire, this variable is found under the question CCC_Q60 category # 2. For this question, write-in responses were coded into one of the existing listed categories if the write-in information duplicated a listed category.","4"
"CCC_60B","1.0","276","Type of cancer - colorectal","What type of cancer were you diagnosed with? - Colorectal","Respondents who answered CCC_45 = 1 or CCC_55 = 1","In the questionnaire, this variable is found under the question CCC_Q60 category # 3. For this question, write-in responses were coded into one of the existing listed categories if the write-in information duplicated a listed category.","4"
"CCC_60C","1.0","277","Type of cancer - skin - melanoma","What type of cancer were you diagnosed with? - Skin - Melanoma","Respondents who answered CCC_45 = 1 or CCC_55 = 1","In the questionnaire, this variable is found under the question CCC_Q60 category # 4. For this question, write-in responses were coded into one of the existing listed categories if the write-in information duplicated a listed category.","4"
"CCC_60D","1.0","278","Type of cancer - skin - non-melanoma","What type of cancer were you diagnosed with? - Skin - Non-melanoma","Respondents who answered CCC_45 = 1 or CCC_55 = 1","In the questionnaire, this variable is found under the question CCC_Q60 category # 5. For this question, write-in responses were coded into one of the existing listed categories if the write-in information duplicated a listed category.","4"
"CCC_60E","1.0","279","Type of cancer - ovarian","What type of cancer were you diagnosed with? - Ovarian","Respondents with DHH_SEX = 2 and CCC_45 = 1 or CCC_55 = 1","In the questionnaire, this variable is found under the question CCC_Q60 category # 6. For this question, write-in responses were coded into one of the existing listed categories if the write-in information duplicated a listed category.","4"
"CCC_60F","1.0","280","Type of cancer - cervical","What type of cancer were you diagnosed with? - Cervical","Respondents with DHH_SEX = 2 and CCC_45 = 1 or CCC_55 = 1","In the questionnaire, this variable is found under the question CCC_Q60 category # 7. For this question, write-in responses were coded into one of the existing listed categories if the write-in information duplicated a listed category.","4"
"CCC_60G","1.0","281","Type of cancer - uterine","What type of cancer were you diagnosed with? -Uterine","Respondents with DHH_SEX = 2 and CCC_45 = 1 or CCC_55 = 1","In the questionnaire, this variable is found under the question CCC_Q60 category # 8. For this question, write-in responses were coded into one of the existing listed categories if the write-in information duplicated a listed category.","4"
"CCC_60H","1.0","282","Type of cancer - lung","What type of cancer were you diagnosed with? -Lung","Respondents who answered CCC_45 = 1 or CCC_55 = 1","In the questionnaire, this variable is found under the question CCC_Q60 category # 9. For this question, write-in responses were coded into one of the existing listed categories if the write-in information duplicated a listed category.","4"
"CCC_60I","1.0","283","Type of cancer - other","What type of cancer were you diagnosed with? - Other","Respondents who answered CCC_45 = 1 or CCC_55 = 1","In the questionnaire, this variable is found under the question CCC_Q60 category # 10. For this question, write-in responses were coded into one of the existing listed categories if the write-in information duplicated a listed category.","4"
"CCC_65","1.0","284","Has heart disease","Do you have heart disease?","Respondents with DOCCC = 1","","3"
"CCC_70","3.0","285","Heart disease - age first diagnosed","How old were you when this was first diagnosed?","Respondents who answered CCC_65 = 1","","3"
"CCC_75","1.0","288","Has had a heart attack - lifetime","Have you ever been told by a health professional that you have had a heart attack?","Respondents with DOCCC = 1","","3"
"CCC_80","1.0","289","Has high blood pressure","Do you have high blood pressure?","Respondents with DOCCC = 1","","3"
"CCC_85","1.0","290","High blood pressure - took medication - 1 mo","In the past month, have you taken any medicine for high blood pressure?","Respondents with DOCCC = 1","","3"
"CCC_90","1.0","291","Has had high blood cholesterol - lifetime","Have you ever been told by a health professional that your blood cholesterol was high?","Respondents with DOCCC = 1","","3"
"CCC_95","1.0","292","Suffers from the effects of a stroke","Do you suffer from the effects of a stroke?","Respondents aged 20 and over with DOCCC = 1","","4"
"CCC_100","1.0","293","Has osteoporosis","Do you have osteoporosis?","Respondents aged 40 and over with DOCCC = 1","","4"
"CCC_105","1.0","294","Has fibromyalgia","Do you have fibromyalgia?","Respondents with DOCCC = 1","","3"
"CCC_110","3.0","295","Fibromyalgia - age first symptoms","How old were you when the first symptoms appeared?","Respondents who answered CCC_105 = 1","","3"
"CCC_115","3.0","298","Fibromyalgia - age first diagnosed","How old were you when this was first diagnosed?","Respondents who answered CCC_105 = 1","","3"
"CCC_120","1.0","301","Has arthritis (e.g. osteoarthritis, rheumatoid arthritis, gout)","Do you have arthritis?","Respondents with DOCCC = 1","","3"
"CCC_125","1.0","302","Has back problems (excluding scoliosis, fibromyalgia and arthritis)","Do you have back problems?","Respondents with DOCCC = 1","","3"
"CCC_130","1.0","303","Back problems - diagnosed by health professional","Was this diagnosed by a health professional?","Respondents who answered CCC_125 = 1","","4"
"CCC_135","1.0","304","Has a mood disorder (depression, bipolar, mania, dysthymia)","Do you have a mood disorder?","Respondents with DOCCC = 1","","3"
"CCCDVDIA","1.0","305","Diabetes type - 12 mo - (D)","","See documentation on derived variables.","","5"
"DOCC1","1.0","306","Chronic conditions (1) - Inclusion Flag - (F)","","All respondents","","2"
"CC1_140","1.0","307","Has an anxiety disorder (phobia, panic, generalized anxiety)","Do you have an anxiety disorder?","Respondents with DOCC1 = 1","","4"
"CC1_145","1.0","308","Has post-traumatic stress disorder (PTSD)","Do you have post-traumatic stress disorder (PTSD)?","Respondents with DOCC1 = 1","","4"
"CC1_150","1.0","309","Has Alzheimer’s Disease / other dementia","Do you have Alzheimer’s disease or any other dementia?","Respondents aged 40 and over with DOCCC = 1","","4"
"CC1_155","1.0","310","Has chronic fatigue syndrome","Do you have chronic fatigue syndrome (CFS)?","Respondents with DOCC1 = 1","","4"
"CC1_160","3.0","311","Chronic fatigue syndrome - age first symptoms","How old were you when the first symptoms appeared?","Respondents who answered CC1_155 = 1","","3"
"CC1_165","3.0","314","Chronic fatigue syndrome - age first diagnosed","How old were you when this was first diagnosed?","Respondents who answered CC1_155 = 1","","3"
"CC1_170","1.0","317","Has multiple chemical sensitivities (MCS)","Do you have multiple chemical sensitivities (MCS)?","Respondents with DOCC1 = 1","","4"
"CC1_175","3.0","318","Multiple chemical sensitivities - age first symptoms","How old were you when the first symptoms appeared?","Respondents who answered CC1_170 = 1","","3"
"CC1_180","3.0","321","Multiple chemical sensitivitiesage first diagnosed","How old were you when this was first diagnosed?","Respondents who answered CC1_170 = 1","","3"
"DOHUI","1.0","324","Health utility index - Inclusion Flag - (F)","","All respondents","","1"
"HUI_005","1.0","325","Vision - read newsprint without glasses / contacts","Are you usually able to see well enough to read ordinary newsprint without glasses or contact lenses?","Respondents with DOHUI = 1","","3"
"HUI_010","1.0","326","Vision - read newsprint with glasses / contacts","Are you usually able to see well enough to read ordinary newsprint with glasses or contact lenses?","Respondents who answered HUI_005 = 2","","4"
"HUI_015","1.0","327","Vision - able to see","Are you able to see at all?","Respondents who answered HUI_010 = 2","","4"
