"variable_name","length","position","label","question_text","universe","note","n_categories"
"MPADTOWD","4.0","562","Moderate physical activity - 7 d - weekend - total mins","","See documentation on derived variables","","0"
"MPADTOWK","4.0","566","Moderate physical activity - 7 d - week - total mins","","See documentation on derived variables","","2"
"MPADTRWD","4.0","570","Active transportation - walking/cycling - 7 d - weekend - total mins","","See documentation on derived variables","","3"
"MPADTRWK","4.0","574","Active transportation - walking/cycling - 7 d - week - total mins","","See documentation on derived variables","","1"
"MPADWAWD","3.0","578","Active transportation - walking - 7 d - weekend - total mins","","See documentation on derived variables","","1"
"MPADWAWK","3.0","581","Active transportation - walking - 7 d - week - total mins","","See documentation on derived variables","","1"
"MPADWOWD","4.0","584","Active work as part of job - 7 d - weekend - total mins","","See documentation on derived variables","","2"
"MPADWOWK","4.0","588","Active work as part of job - 7 d - week - total mins","","See documentation on derived variables","","2"
"DOOPA","1.0","592","Other physical activities - Inclusion flag - (F)","","All respondents","","1"
"OPA_10","2.0","593","Strenght-buidling exercises - num of days - 7 d","In the past 7 days, how many days did you engage in strength-building exercise?","Respondents with DOOPA = 1","","9"
"OPA_15","2.0","595","Flexibility exercises - num of days - 7 d","In the past 7 days, how many days did you engage in flexibility exercises?","Respondents with DOOPA = 1","","9"
"OPA_20","2.0","597","Vigorous-intensity exercises - num of days - 7 d","In the past 7 days, how many days did you engage in any vigorous-intensity exercise?","Respondents with DOOPA = 1","","9"
"OPAD24ST","1.0","599","24-hour movement guidelines - strength training","","See documentation on derived variables.","","3"
"DOCSS","1.0","600","Current smoking status - Inclusion Flag - (F)","","All respondents","","1"
"CSS_05","1.0","601","Smoked a whole cigarette - lifetime","Have you ever smoked a whole cigarette?","Respondents with DOCSS = 1","","3"
"CSS_10","3.0","602","Smoked first whole cigarette - age","How old were you when you smoked your first whole cigarette?","Respondents who answered CSS_05 = 1","","3"
"CSS_15","1.0","605","Smoked more than 100 cigarettes - lifetime","Have you smoked more than 100 cigarettes (about 4 packs) in your life?","Respondents who answered CSS_05 = 1","","4"
"CSS_20","1.0","606","Smoked - frequency - 30 d","In the past 30 days, how often did you smoke cigarettes?","Respondents who answered CSS_05 = 1","","6"
"CSS_25","3.0","607","Num of cigarettes smoked daily (daily smoker)","How many cigarettes do you usually smoke each day?","Respondents who answered CSS_20 = 1","","3"
"CSS_35","2.0","610","Smoked 1 cigarette or more (occasional smoker) - Num of days - 30 d","In the past 30 days, how many days have you smoked one or more cigarettes?","Respondents who answered CSS_20 = ( 2, 3)","","3"
"CSS_30","3.0","612","Num of cigarettes smoked daily (occasional smoker)","On the days that you do smoke, how many cigarettes do you usually smoke?","Respondents who answered CSS_20 = (2, 3)","","3"
"CSS_41","1.0","615","Stopped smoking for at least 24h - 12 mo","In the past 12 months, did you stop smoking for at least 24 hours because you were trying to cut back or quit?","Respondents who answered CSS_20 = ( 1, 2, 3)","","4"
"DOSPU","1.0","616","Smoking - past use - Inclusion Flag - (F)","","All respondents","","1"
"SPU_05","1.0","617","Smoked daily - lifetime (occasional / former smoker)","Have you ever smoked cigarettes daily?","Respondents with DOSPU = 1 and ((CSS_20 = (2, 3)) or (CSS_20 = 4 and CCS_15 = 1))","","4"
"SPU_10","1.0","618","Stopped smoking - when (former occasional smoker)","When did you stop smoking?","Respondents who answered SPU_05 = 2 and (CSS_20 = 4 and CCS_15 = 1)","","6"
"SPU_15","3.0","619","Began smoking daily - age (daily / former daily smoker)","At what age did you begin to smoke cigarettes daily?","Respondents who answered CSS_20 = 1 or SPU_05 = 1","","3"
"SPU_20","3.0","622","Num of cigarettes smoked daily (former daily smoker)","When you smoked every day, how many cigarettes did you usually smoke each day?","Respondents who answered CSS_20 ? 1 and SPU_05 = 1","","3"
"SPU_25","1.0","625","Stopped smoking daily - when (former daily smoker)","When did you stop smoking daily?","Respondents who answered CSS_20 ? 1 and SPU_05 = 1","","6"
"SPU_30","1.0","626","Quit smoking completely - (former daily smoker)","Was that when you completely quit smoking?","Respondents who answered CSS_20 = 4 and CSS_15 = 1 and SPU_05 = 1","","4"
"SPU_35","1.0","627","Quit smoking completely - when (former daily smoker)","When did you stop completely?","Respondents who answered SPU_30 = 2","","6"
"SPU_40A","1.0","628","Help to quit smoking - nicotine replacement products - 12 mo","During the past 12 months, did you do any of the following to help you quit smoking? - Use nicotine replacement products","Respondents who answered CSS_41 = 1 and (CSS_20 = 1 or CSS_20 = (2, 3) or ((CSS_20 = 4 and CSS_15 = 1 and SPU_05 = 1) or (CSS_20 = 4 and CSS_15 = 1 and SPU_05 = (2, NR) and SPU_10 = 1)))","","4"
"SPU_40B","1.0","629","Help to quit smoking - smoking cessation medications - 12 mo","During the past 12 months, did you do any of the following to help you quit smoking? - Use smoking cessation medications","Respondents who answered CSS_41 = 1 and (CSS_20 = 1 or CSS_20 = (2, 3) or ((CSS_20 = 4 and CSS_15 = 1 and SPU_05 = 1) or (CSS_20 = 4 and CSS_15 = 1 and SPU_05 = (2, NR) and SPU_10 = 1)))","","4"
"SPU_40C","1.0","630","Help to quit smoking - internet-based program / app - 12 mo","During the past 12 months, did you do any of the following to help you quit smoking? - Use an internet-based program or an app","Respondents who answered CSS_41 = 1 and (CSS_20 = 1 or CSS_20 = (2, 3) or ((CSS_20 = 4 and CSS_15 = 1 and SPU_05 = 1) or (CSS_20 = 4 and CSS_15 = 1 and SPU_05 = (2, NR) and SPU_10 = 1)))","","4"
"SPU_40D","1.0","631","Help to quit smoking - vaping device / e-cigarette - 12 mo","During the past 12 months, did you do any of the following to help you quit smoking? - Use a vaping device or e-cigarette","Respondents who answered CSS_41 = 1 and (CSS_20 = 1 or CSS_20 = (2, 3) or ((CSS_20 = 4 and CSS_15 = 1 and SPU_05 = 1) or (CSS_20 = 4 and CSS_15 = 1 and SPU_05 = (2, NR) and SPU_10 = 1)))","","4"
"SPU_40E","1.0","632","Help to quit smoking - deal with friend / family - 12 mo","During the past 12 months, did you do any of the following to help you quit smoking? - Make a deal with a friend or your family","Respondents who answered CSS_41 = 1 and (CSS_20 = 1 or CSS_20 = (2, 3) or ((CSS_20 = 4 and CSS_15 = 1 and SPU_05 = 1) or (CSS_20 = 4 and CSS_15 = 1 and SPU_05 = (2, NR) and SPU_10 = 1)))","","4"
"SPU_40F","1.0","633","Help to quit smoking - reduce number of cigarettes - 12 mo","During the past 12 months, did you do any of the following to help you quit smoking? - Reduce the number of cigarettes","Respondents who answered CSS_41 = 1 and (CSS_20 = 1 or CSS_20 = (2, 3) or ((CSS_20 = 4 and CSS_15 = 1 and SPU_05 = 1) or (CSS_20 = 4 and CSS_15 = 1 and SPU_05 = (2, NR) and SPU_10 = 1)))","","4"
"SPU_40G","1.0","634","Help to quit smoking - on their own - 12 mo","During the past 12 months, did you do any of the following to help you quit smoking? - Try to quit smoking on your own","Respondents who answered CSS_41 = 1 and (CSS_20 = 1 or CSS_20 = (2, 3) or ((CSS_20 = 4 and CSS_15 = 1 and SPU_05 = 1) or (CSS_20 = 4 and CSS_15 = 1 and SPU_05 = (2, NR) and SPU_10 = 1)))","","4"
"SPU_40H","1.0","635","Help to quit smoking - other - 12 mo","During the past 12 months, did you do any of the following to help you quit smoking? - Other","Respondents who answered CSS_41 = 1 and (CSS_20 = 1 or CSS_20 = (2, 3) or ((CSS_20 = 4 and CSS_15 = 1 and SPU_05 = 1) or (CSS_20 = 4 and CSS_15 = 1 and SPU_05 = (2, NR) and SPU_10 = 1)))","","4"
"SPU_45A","1.0","636","Help to quit smoking completely - nicotine replacement prod - 12 mo","During the past 12 months, did you do any of the following to help you when you quit smoking completely? - Use nicotine replacement products","Respondents who answered (SPU_Q10 = 1 or (SPU_Q25 = 1 and SPU_Q30 = 1) or SPU_Q35 = 1)","","4"
"SPU_45B","1.0","637","Help to quit smoking completely - smoking cessation meds - 12 mo","During the past 12 months, did you do any of the following to help you when you quit smoking completely? - Use smoking cessation medications","Respondents who answered (SPU_Q10 = 1 or (SPU_Q25 = 1 and SPU_Q30 = 1) or SPU_Q35 = 1)","","4"
"SPU_45C","1.0","638","Help to quit smoking completely - internet-based program / app - 12 mo","During the past 12 months, did you do any of the following to help you when you quit smoking completely? - Use an internet-based program or an app","Respondents who answered (SPU_Q10 = 1 or (SPU_Q25 = 1 and SPU_Q30 = 1) or SPU_Q35 = 1)","","4"
"SPU_45D","1.0","639","Help to quit smoking completely - vaping device / e-cigarette - 12 mo","During the past 12 months, did you do any of the following to help you when you quit smoking completely? - Use a vaping device or e-cigarette","Respondents who answered (SPU_Q10 = 1 or (SPU_Q25 = 1 and SPU_Q30 = 1) or SPU_Q35 = 1)","","4"
"SPU_45E","1.0","640","Help to quit smoking completely - deal with friend / family - 12 mo","During the past 12 months, did you do any of the following to help you when you quit smoking completely? - Make a deal with a friend or your family","Respondents who answered (SPU_Q10 = 1 or (SPU_Q25 = 1 and SPU_Q30 = 1) or SPU_Q35 = 1)","","4"
"SPU_45F","1.0","641","Help to quit smoking completely - reduce number of cigarettes - 12 mo","During the past 12 months, did you do any of the following to help you when you quit smoking completely? - Reduce the number of cigarettes","Respondents who answered (SPU_Q10 = 1 or (SPU_Q25 = 1 and SPU_Q30 = 1) or SPU_Q35 = 1)","","4"
"SPU_45G","1.0","642","Help to quit smoking completely - on their own - 12 mo","During the past 12 months, did you do any of the following to help you when you quit smoking completely? - Try to quit smoking on your own","Respondents who answered (SPU_Q10 = 1 or (SPU_Q25 = 1 and SPU_Q30 = 1) or SPU_Q35 = 1)","","4"
"SPU_45H","1.0","643","Help to quit smoking completely - other - 12 mo","During the past 12 months, did you do any of the following to help you when you quit smoking completely? - Other","Respondents who answered (SPU_Q10 = 1 or (SPU_Q25 = 1 and SPU_Q30 = 1) or SPU_Q35 = 1)","","4"
"SMKDVSTY","2.0","644","Smoking status (type 2) - traditional definition - (D)","","See documentation on derived variables.","","7"
"SMKDVYCS","3.0","646","Num of years respondent has smoked daily - (D)","","See documentation on derived variables.","","3"
"DOECV","1.0","649","Electronic cigarettes and vaping - Inclusion Flag - (F)","","All respondents","","1"
"ECV_05","1.0","650","Tried e-cigarette / vape - life","Have you ever tried an e-cigarette or vaping device, also known as a vape?","Respondents with DOECV = 1","","3"
"ECV_10","3.0","651","Tried e-cigarette / vape - age","At what age did you first use an e-cigarette or vaping device?","Respondents who answered ECV_05 = 1","","3"
"ECV_15","1.0","654","Used e-cigarette / vape - freq - 30 d","In the past 30 days, how often did you use an e-cigarette or vaping device?","Respondents who answered ECV_05 = 1","","6"
"ECV_21","1.0","655","Used e-cigarette / vape - last time - content","The last time you used an e-cigarette or vaping device, also known as a vape, what did it contain?","Respondents who answered ECV_15 = (1, 2, 3)","","5"
"ECV_25A","2.0","656","Vaped - with nicotine - num of days - 30 d","During the past 30 days, on how many days did you vape an e-cigarette or a vaping device with nicotine?","Respondents who answered ECV_21 = 1","","3"
"ECV_25B","2.0","658","Vaped - without nicotine - num of days - 30 d","During the past 30 days, on how many days did you vape an e-cigarette or a vaping device without nicotine?","Respondents who answered ECV_21 = 2","","3"
"ECV_25C","2.0","660","Vaped - unknown content - num of days - 30 d","During the past 30 days, on how many days did you vape an e-cigarette or a vaping device but you did not know what it contained?","Respondents who answered ECV_21 = 3","","3"
"ECV_30","1.0","662","Tried first - e-cigarette / vape or cigarette","Which did you try first, an e-cigarette or vaping device or a cigarette?","Respondents who answered CSS_05 = 1 and (ECV_10 = CSS_10)","","4"
"ECVDVSMK","1.0","663","E-Cigarette / vaping device and cigarette use - (D)","","See documentation on derived variables.","","6"
"DOALC","1.0","664","Alcohol use - Inclusion Flag - (F)","","All respondents","","1"
"ALC_05","1.0","665","Had a drink - lifetime","Have you ever had a drink in your lifetime?","Respondents with DOALC = 1","","3"
"ALC_10","1.0","666","Drank alcohol - 12 mo","In the past 12 months, have you had a drink of beer, wine, liquor or any other alcoholic beverage?","Respondents who answered ALC_05 = 1","","4"
"ALC_15","2.0","667","Drank alcohol - frequency - 12 mo","In the past 12 months, how often did you drink alcoholic beverages?","Respondents who answered ALC_10 = 1","","9"
"ALC_20","2.0","669","Drank 5+ / 4+ drinks one occasion - frequency - 12 mo","How often in the past 12 months have you had [5 / 4] or more drinks on one occasion?","Respondents who answered ALC_10 = 1","","8"
"ALCDVTTM","1.0","671","Type of drinker - 12 mo - (D)","","See documentation on derived variables.","","4"
"DOALW","1.0","672","Alcohol use - past week - Inclusion Flag - (F)","","All respondents","","1"
"ALW_05","1.0","673","Drank alcohol - 7 d","In the past 7 days, that is from [day of the week 7 days ago] to yesterday, did you have a drink of beer, wine, liquor or any other alcoholic beverage?","Respondents with DOALW = 1 and ALC_05 = 1 and ALC_10 = 1","","4"
"ALW_10","2.0","674","Number of drinks - yesterday","In the past 7 days, that is from [day of the week 7 days ago] to yesterday, how many drinks did you have each day? a. [day of the week YESTERDAY]","Respondents who answered ALW_05 = 1","","25"
"ALW_15","2.0","676","Number of drinks - 2 days ago","In the past 7 days, that is from [day of the week 7 days ago] to yesterday, how many drinks did you have each day? b. [day of the week 2 days ago]","Respondents who answered ALW_05 = 1","","24"
"ALW_20","2.0","678","Number of drinks - 3 days ago","In the past 7 days, that is from [day of the week 7 days ago] to yesterday, how many drinks did you have each day? c. [day of the week 3 days ago]","Respondents who answered ALW_05 = 1","","24"
"ALW_25","2.0","680","Number of drinks - 4 days ago","In the past 7 days, that is from [day of the week 7 days ago] to yesterday, how many drinks did you have each day? d. [day of the week 4 days ago]","Respondents who answered ALW_05 = 1","","28"
"ALW_30","2.0","682","Number of drinks - 5 days ago","In the past 7 days, that is from [day of the week 7 days ago] to yesterday, how many drinks did you have each day? e. [day of the week 5 days ago]","Respondents who answered ALW_05 = 1","","26"
"ALW_35","2.0","684","Number of drinks - 6 days ago","In the past 7 days, that is from [day of the week 7 days ago] to yesterday, how many drinks did you have each day? f. [day of the week 6 days ago]","Respondents who answered ALW_05 = 1","","26"
"ALW_40","2.0","686","Number of drinks - 7 days ago","In the past 7 days, that is from [day of the week 7 days ago] to yesterday, how many drinks did you have each day? g. [day of the week 7 days ago]","Respondents who answered ALW_05 = 1","","24"
"ALWDVWKY","3.0","688","Alcohol weekly consumption","","See documentation on derived variables.","","4"
"ALWDVDLY","3.0","691","Average daily alcohol consumption","","See documentation on derived variables.","","3"
"ALWDVRSK","1.0","694","Low risk drinking guideline adherence","","See documentation on derived variables.","","6"
"DOCAN","1.0","695","Cannabis use - Inclusion Flag - (F)","","All respondents","","1"
"CAN_05","1.0","696","Used cannabis - lifetime","Have you ever used or tried cannabis?","Respondents with DOCAN = 1 and PROXYSEX = (1, 2)","","3"
"CAN_05A","1.0","697","Used cannabis - once or more - lifetime","Have you used or tried cannabis just once or more than once?","Respondents who answered CAN_05 = 1","","4"
"CAN_05B","3.0","698","Used cannabis - first time - age","At what age did you first try cannabis?","Respondents who answered CAN_05A = (1, 2)","","3"
"CAN_05C","1.0","701","Used cannabis - 12 mo","Have you used cannabis in the past 12 months?","Respondents who answered CAN_05A = (1, 2)","If a respondent answered CAN_05 = 2, the variable CAN_05C was filled with the value of 2.","3"
"CAN_10","1.0","702","Used cannabis - frequency - 12 mo","How often did you use cannabis in the past 12 months?","Respondents who answered CAN_05A = 2 and CAN_05C = 1","If a respondent answered CAN_05A = 1 and CAN_05C = 1, the variable CAN_10 was filled with the value of 1.","7"
"CAN_15A","1.0","703","Used cannabis - method - smoked - 12 mo","In the past 12 months, which of the following methods did you use to consume cannabis? - Smoked","Respondents who answered CAN_05A = 2 and CAN_05C = 1","For this question, write-in responses were coded into one of the existing listed categories if the write-in information duplicated a listed category.","4"
"CAN_15B","1.0","704","Used cannabis - method - vaporized - 12 mo","In the past 12 months, which of the following methods did you use to consume cannabis? - Vaporized","Respondents who answered CAN_05A = 2 and CAN_05C = 1","For this question, write-in responses were coded into one of the existing listed categories if the write-in information duplicated a listed category.","4"
"CAN_15C","1.0","705","Used cannabis - method - swallowed - 12 mo","In the past 12 months, which of the following methods did you use to consume cannabis? - Swallowed","Respondents who answered CAN_05A = 2 and CAN_05C = 1","For this question, write-in responses were coded into one of the existing listed categories if the write-in information duplicated a listed category.","4"
"CAN_15D","1.0","706","Used cannabis - method - absorbed - 12 mo","In the past 12 months, which of the following methods did you use to consume cannabis? - Absorbed","Respondents who answered CAN_05A = 2 and CAN_05C = 1","For this question, write-in responses were coded into one of the existing listed categories if the write-in information duplicated a listed category.","4"
"CAN_15E","1.0","707","Used cannabis - method - other - 12 mo","In the past 12 months, which of the following methods did you use to consume cannabis? - Other","Respondents who answered CAN_05A = 2 and CAN_05C = 1","For this question, write-in responses were coded into one of the existing listed categories if the write-in information duplicated a listed category.","4"
"CAN_15BA","1.0","708","Used cannabis - vaporized - dried flower, leaf","Which cannabis preparation did you vaporize? - Dried flower or leaf","Respondents who answered CAN_15B = 1","","4"
"CAN_15BB","1.0","709","Used cannabis - vaporized - cannabis liquid","Which cannabis preparation did you vaporize? - Cannabis liquid","Respondents who answered CAN_15B = 1","","4"
"CAN_15BC","1.0","710","Used cannabis - vaporized - cannabis solid","Which cannabis preparation did you vaporize? - Cannabis solid","Respondents who answered CAN_15B = 1","","4"
"CAN_20","1.0","711","Used cannabis - method used most often - 12 mo","In the past 12 months, which of the following methods did you use most often to consume cannabis?","Respondents who answered CAN_05A = 2 and CAN_05C = 1","","7"
"CAN_25A","1.0","712","Used cannabis - product - Dried flower or leaf - 12 mo","In the past 12 months, which of the following cannabis products have you used? - Dried flower or leaf","Respondents who answered CAN_05A = 2 and CAN_05C = 1","For this question, write-in responses were coded into one of the existing listed categories if the write-in information duplicated a listed category.","4"
"CAN_25B","1.0","713","Used cannabis - product - hashish - 12 mo","In the past 12 months, which of the following cannabis products have you used? - Hashish","Respondents who answered CAN_05A = 2 and CAN_05C = 1","For this question, write-in responses were coded into one of the existing listed categories if the write-in information duplicated a listed category.","4"
"CAN_25C","1.0","714","Used cannabis - product - cannabis oil - 12 mo","In the past 12 months, which of the following cannabis products have you used? - Cannabis oil for oral use","Respondents who answered CAN_05A = 2 and CAN_05C = 1","For this question, write-in responses were coded into one of the existing listed categories if the write-in information duplicated a listed category.","4"
"CAN_25D","1.0","715","Used cannabis - product - cannabis vape pens / cartridges - 12 mo","In the past 12 months, which of the following cannabis products have you used? - Cannabis vape pens or cartridges","Respondents who answered CAN_05A = 2 and CAN_05C = 1","For this question, write-in responses were coded into one of the existing listed categories if the write-in information duplicated a listed category.","4"
"CAN_25E","1.0","716","Used cannabis - product - cannabis concentrates - 12 mo","In the past 12 months, which of the following cannabis products have you used? - Cannabis concentrates","Respondents who answered CAN_05A = 2 and CAN_05C = 1","For this question, write-in responses were coded into one of the existing listed categories if the write-in information duplicated a listed category.","4"
"CAN_25F","1.0","717","Used cannabis - product - cannabis edible food products - 12 mo","In the past 12 months, which of the following cannabis products have you used? - Cannabis edible food products","Respondents who answered CAN_05A = 2 and CAN_05C = 1","For this question, write-in responses were coded into one of the existing listed categories if the write-in information duplicated a listed category.","4"
"CAN_25G","1.0","718","Used cannabis - product - cannabis beverages - 12 mo","In the past 12 months, which of the following cannabis products have you used? - Cannabis beverages","Respondents who answered CAN_05A = 2 and CAN_05C = 1","For this question, write-in responses were coded into one of the existing listed categories if the write-in information duplicated a listed category.","4"
"CAN_25H","1.0","719","Used cannabis - product - topicals - 12 mo","In the past 12 months, which of the following cannabis products have you used? - - Topicals","Respondents who answered CAN_05A = 2 and CAN_05C = 1","For this question, write-in responses were coded into one of the existing listed categories if the write-in information duplicated a listed category.","4"
"CAN_25I","1.0","720","Used cannabis - product - other - 12 mo","In the past 12 months, which of the following cannabis products have you used? - Other","Respondents who answered CAN_05A = 2 and CAN_05C = 1","For this question, write-in responses were coded into one of the existing listed categories if the write-in information duplicated a listed category.","4"
"CAN_30","1.0","721","Used cannabis - purpose - 12 mo","In the past 12 months, for which of the following purposes have you used cannabis?","Respondents who answered CAN_05A = 2 and CAN_05C = 1","","5"
"CAN_35A","1.0","722","Used cannabis - medical purpose - pain - 12 mo","In the past 12 months, when you used cannabis for medical purposes, which symptoms were you using it for? - Pain","Respondents who answered CAN_30 = (2, 3)","For this question, write-in responses were coded into one of the existing listed categories if the write-in information duplicated a listed category.","4"
"CAN_35B","1.0","723","Used cannabis - medical purpose - nausea vomiting - 12 mo","In the past 12 months, when you used cannabis for medical purposes, which symptoms were you using it for? - Nausea or vomiting","Respondents who answered CAN_30 = (2, 3)","For this question, write-in responses were coded into one of the existing listed categories if the write-in information duplicated a listed category.","4"
"CAN_35C","1.0","724","Used cannabis - medical purpose - lack of appetite - 12 mo","In the past 12 months, when you used cannabis for medical purposes, which symptoms were you using it for? - Lack of appetite or weight loss","Respondents who answered CAN_30 = (2, 3)","For this question, write-in responses were coded into one of the existing listed categories if the write-in information duplicated a listed category.","4"
"CAN_35D","1.0","725","Used cannabis - medical purpose - headaches / migraines - 12 mo","In the past 12 months, when you used cannabis for medical purposes, which symptoms were you using it for? - Headaches or migraines","Respondents who answered CAN_30 = (2, 3)","For this question, write-in responses were coded into one of the existing listed categories if the write-in information duplicated a listed category.","4"
"CAN_35E","1.0","726","Used cannabis - medical purpose - muscle spasms / seizures - 12 mo","In the past 12 months, when you used cannabis for medical purposes, which symptoms were you using it for? - Muscle spasms or seizures","Respondents who answered CAN_30 = (2, 3)","For this question, write-in responses were coded into one of the existing listed categories if the write-in information duplicated a listed category.","4"
